{
  "$schema": "./reimplementation.schema.json",
  "schema_version": 4,
  "ledger_id": "haruquantai.sqx.reimplementation",
  "reference_product": {
    "name": "StrategyQuant X",
    "build": "145-dev1",
    "installation_root_variable": "SQX_REFERENCE_ROOT"
  },
  "target_project": {
    "name": "HaruQuantAI",
    "repository_root_variable": "HARUQUANTAI_ROOT",
    "authority_files": [
      "AGENTS.md",
      "docs/PROJECT.md",
      "docs/ARCHITECTURE.md",
      "app/host/README.md",
      "docs/SQX/architecture-and-reimplementation.md"
    ]
  },
  "source_catalog": {
    "E-L01": {
      "title": "StrategyQuant X Build 145 reference installation artifacts",
      "kind": "local_directory",
      "root": "SQX_REFERENCE_ROOT",
      "locators": [
        "StrategyQuantX.config",
        "sqcli.config",
        "CodeEditor.config",
        "Extending_SQX.pdf",
        "internal/AppSettings.txt",
        "internal/libs",
        "internal/plugins",
        "internal/extend",
        "internal/ctemplate"
      ],
      "scope": "Read-only static inspection of launcher configs, encrypted/unencrypted JARs, JSPF plugin bundles, XML block templates, and Java snippets.",
      "confidence": "confirmed",
      "limitations": [
        "Static artifact inspection only; no donor runtime execution or live license activation is performed."
      ]
    },
    "E-R01": {
      "title": "HaruQuantAI repository authorities, decompiled catalogs, and static inventory",
      "kind": "repository",
      "root": "HARUQUANTAI_ROOT",
      "locators": [
        "AGENTS.md",
        "docs/PROJECT.md",
        "docs/ARCHITECTURE.md",
        "app/host/README.md",
        "docs/SQX/README.md",
        "docs/SQX/architecture-and-reimplementation.md",
        "docs/SQX/libs/SQLib.md",
        "docs/SQX/libs/SQDataLib.md",
        "docs/SQX/libs/SQTradingLib.md",
        "docs/dev/evidence/p00-inventory.json"
      ],
      "scope": "Target architectural authorities, clean-room decompiled class/method catalogs, and SHA-256 inventory captures.",
      "confidence": "confirmed",
      "limitations": [
        "Repository documentation and static inventory do not establish backend runtime availability or numerical parity."
      ]
    }
  },
  "installed_product_status": {
    "build": null,
    "activation": "unverified",
    "runtime_parity": "unqualified"
  },
  "minimum_record_number": 1,
  "allocation_high_water_mark": 5,
  "records": {
    "SQX145-EV-000001": {
      "topic": "architecture.process.two_process_topology",
      "title": "SQX-145 two-process runtime boundary and launcher entrypoints",
      "question": "How are the SQX-145 desktop shell and JVM backend processes launched and decoupled?",
      "record_status": "active",
      "reference_scope": {
        "build": "145-dev1",
        "application_areas": [
          "host_bootstrap",
          "transport"
        ],
        "conditions": [
          "Static inspection of launcher configuration files and clean-room architectural documentation."
        ]
      },
      "claim": {
        "classification": "observed",
        "statement": "SQX-145 separates execution into a JVM backend process launched via StrategyQuantX.config (com.strategyquant.strategyquant.SQStarter), sqcli.config (SQConsoleStarter), or CodeEditor.config (cef.CefAppFrame) and an Electron/Chromium UI shell (StrategyQuantX_ui.exe) communicating over localhost HTTP and WebSockets.",
        "confidence": "confirmed",
        "limitations": [
          "Static config inspection only; runtime socket handshake is not executed in Stage 0."
        ]
      },
      "sources": [
        {
          "catalog_id": "E-L01",
          "artifact_locator": "StrategyQuantX.config",
          "location": {
            "section": "mainclass",
            "symbol": "com.strategyquant.strategyquant.SQStarter",
            "line_range": "1-10",
            "json_pointer": null,
            "xpath": null,
            "notes": "Declares JVM flags,jarpath internal/libs, and SQStarter entrypoint."
          },
          "inspection_method": "config_inspection",
          "relation": "supports",
          "fingerprint": {
            "algorithm": "sha256",
            "value": "fc1b6de40f29090a61892ae161f9daca80e277366c7bfae0f4396248ee58799d"
          },
          "accessed_at": "2026-10-13"
        },
        {
          "catalog_id": "E-L01",
          "artifact_locator": "sqcli.config",
          "location": {
            "section": "mainclass",
            "symbol": "com.strategyquant.strategyquant.SQConsoleStarter",
            "line_range": "1-10",
            "json_pointer": null,
            "xpath": null,
            "notes": "Declares headless CLI starter class SQConsoleStarter."
          },
          "inspection_method": "config_inspection",
          "relation": "supports",
          "fingerprint": {
            "algorithm": "sha256",
            "value": "cc75c454d24a45214728ccffd926e279351ff721ced0f31ea4d700ff6dcc4b35"
          },
          "accessed_at": "2026-10-13"
        }
      ],
      "target_mapping": {
        "domain": "host",
        "registration_status": "registered",
        "feature_ids": [
          "FEAT-HOST-EVIDENCE"
        ],
        "requirement_ids": [
          "FR-HOST-EVIDENCE-INVENTORY-RECONCILIATION"
        ],
        "decision_ids": [
          "DEC-HOST-SQX145-REFERENCE",
          "DEC-HOST-P00-RELEASE-GATES"
        ],
        "proposed_owner": null,
        "proposed_feature_id": null,
        "proposed_requirement_ids": [],
        "proposed_decision_ids": [],
        "notes": "Informs Stage 1G progressive bootstrap and CLI entrypoints."
      },
      "validation": {
        "state": "passed",
        "kind": "static",
        "procedure": "Verify SHA-256 fingerprints of StrategyQuantX.config and sqcli.config in p00-inventory.json via tests.reference.validate.",
        "expected_observation": "Exact SHA-256 match with zero drift.",
        "actual_observation": "Verified exact SHA-256 fingerprints for StrategyQuantX.config and sqcli.config in p00-inventory.json.",
        "artifact_paths": [
          "docs/dev/evidence/p00-inventory.json"
        ],
        "executed_at": "2026-10-13T21:55:00+03:00"
      },
      "relationships": {
        "supports_records": [],
        "contradicts_records": [],
        "supersedes_records": [],
        "superseded_by": null
      },
      "provenance": {
        "repository_commit": "cb39ca7",
        "created_at": "2026-10-13T21:55:00+03:00",
        "updated_at": "2026-10-13T21:55:00+03:00",
        "review_state": "reviewed"
      },
      "clean_room": {
        "contains_proprietary_source": false,
        "contains_sensitive_data": false,
        "contains_personal_data": false,
        "paraphrased_behavior_only": true,
        "notes": null
      },
      "tags": [
        "architecture",
        "bootstrap",
        "launchers"
      ]
    },
    "SQX145-EV-000002": {
      "topic": "architecture.libs.encrypted_core_jars",
      "title": "SQX-145 encrypted core JAR count and decompiled library mapping",
      "question": "How many encrypted core JAR archives exist in internal/libs and how are their packages organized?",
      "record_status": "active",
      "reference_scope": {
        "build": "145-dev1",
        "application_areas": [
          "core_libraries",
          "reference_tooling"
        ],
        "conditions": [
          "Static inventory of internal/libs/*.jar.enc and repository decompiled catalogs."
        ]
      },
      "claim": {
        "classification": "observed",
        "statement": "SQX_REFERENCE_ROOT/internal/libs contains 8 encrypted core archives (CodeEditor.jar.enc, SQAppLib.jar.enc, SQDataLib.jar.enc, SQGridLib2.jar.enc, SQJobsLib.jar.enc, SQLib.jar.enc, SQPluginLib.jar.enc, StrategyQuant.jar.enc) plus unencrypted Snippets.jar, with com.strategyquant.tradinglib.* and com.strategyquant.webguilib.* packaged inside SQAppLib.jar.enc.",
        "confidence": "confirmed",
        "limitations": [
          "Static archive count and decompiled catalog structure only; does not claim runtime execution parity."
        ]
      },
      "sources": [
        {
          "catalog_id": "E-R01",
          "artifact_locator": "docs/dev/evidence/p00-inventory.json",
          "location": {
            "section": null,
            "symbol": null,
            "line_range": null,
            "json_pointer": "/totals/encrypted_jars",
            "xpath": null,
            "notes": "Records all 8 encrypted JAR SHA-256 digests and total count."
          },
          "inspection_method": "repository_audit",
          "relation": "supports",
          "fingerprint": {
            "algorithm": "sha256",
            "value": "d2a59ff7695b07014f00b6b5a933fccfe2710536ba2272bc9b064ff2430c557c"
          },
          "accessed_at": "2026-10-13"
        },
        {
          "catalog_id": "E-R01",
          "artifact_locator": "docs/SQX/libs/SQTradingLib.md",
          "location": {
            "section": "Overview",
            "symbol": "com.strategyquant.tradinglib",
            "line_range": "1-35",
            "json_pointer": null,
            "xpath": null,
            "notes": "Documents 2,213 classes across 88 subpackages extracted from SQAppLib.jar.enc."
          },
          "inspection_method": "documentation_review",
          "relation": "supports",
          "fingerprint": {
            "algorithm": "sha256",
            "value": "825a94f15a6709f0ae858fbd72f332afd268ae250b28f143be5aab9a19afa78c"
          },
          "accessed_at": "2026-10-13"
        }
      ],
      "target_mapping": {
        "domain": "host",
        "registration_status": "registered",
        "feature_ids": [
          "FEAT-HOST-EVIDENCE"
        ],
        "requirement_ids": [
          "FR-HOST-EVIDENCE-INVENTORY-RECONCILIATION",
          "FR-HOST-EVIDENCE-FIXTURE-VALIDATION"
        ],
        "decision_ids": [